company,date,title,body,url,image,source
"Unaliwear",2025-03-24T00:01:00+00:00,UnaliWear Kanega Watch Reviews,"If any issues come up, UnaliWear will replace the watch for free. The company also covers replacement and shipping at no cost the first time you break the watch. Be aware that UnaliWear does not ...",https://www.consumeraffairs.com/medical-alert-systems/unaliwear-kanega-watch.html,,ConsumerAffairs
"BrainCheck",2024-12-04T10:26:00+00:00,An artificial womb for preemies? Philly company gets $50 million to pursue,"Vitara also has a new CEO: Kim Rodriguez, who brings more than 20 years of experience in the field, most recently as CEO of BrainCheck, a company that provides tools for brain health. According to ...",https://www.msn.com/en-us/health/medical/an-artificial-womb-for-preemies-philly-company-gets-50-million-to-pursue/ar-AA1vfoIe,https://www.bing.com/th?id=ORMS.f46b5e2eca9c65b15866919e16a8f865&pid=Wdp,Philadelphia Inquirer
"Dermala","2025-04-19","No recent news found for Dermala","No content available","#","","System"
"Oralucent","2025-04-19","No recent news found for Oralucent","No content available","#","","System"
"Flowly","2025-04-19","No recent news found for Flowly","No content available","#","","System"
"Rosy Wellness","2025-04-19","No recent news found for Rosy Wellness","No content available","#","","System"
"De Oro Devices","2025-04-19","No recent news found for De Oro Devices","No content available","#","","System"
"Partum Health","2025-04-19","No recent news found for Partum Health","No content available","#","","System"
"Fort Health",2023-02-08T00:00:00+00:00,Fort Health,"allowing Fort Health to rapidly train its therapists using evidence-based therapeutic protocols, which may lead to... Digital obsessive-compulsive disorder (OCD) identification and management platform NOCD closed a $35 million funding round co-led by Cigna ...",https://www.mobihealthnews.com/tag/fort-health,,MobiHealthNews
"Fort Health",2025-03-18T00:00:00+00:00,Fort Health Partners with Colleva to Train its Therapists with AI Patient Avatars for Role-Playing Practice and Scalable Client Care,"co-founder and president of Colleva. ""It's been wonderful working in partnership with the Fort Health team as they share our collective vision of using AI role plays and simulations to enhance ...",https://www.victoriaadvocate.com/fort-health-partners-with-colleva-to-train-its-therapists-with-ai-patient-avatars-for-role/article_1aabcc2c-daf6-58b1-a558-b960053187f5.html,,The Victoria Advocate
"RubyWell","2025-04-19","No recent news found for RubyWell","No content available","#","","System"
"Atlantic Sea Farms","2025-04-19","No recent news found for Atlantic Sea Farms","No content available","#","","System"
"VidaFuel","2025-04-19","No recent news found for VidaFuel","No content available","#","","System"
