company,date,title,body,url,image,source
"Unaliwear",2025-05-13T00:00:00+00:00,UnaliWear Kanega Watch Reviews,The UnaliWear Kanega Watch is a more discreet alternative to traditional medical alert devices. The watch weighs 49 grams (about 1.7 ounces). It's 1.6 inches in diameter and 0.5 inches thick.,https://www.consumeraffairs.com/medical-alert-systems/unaliwear-kanega-watch.html,,ConsumerAffairs
"Unaliwear",2025-05-14T07:57:35+00:00,7 Best Medical Altert Systems For Seniors With Fall Detection 2025,"Best Medical Altert Systems For Seniors With Fall Detection 2025 Links to the best Medical Altert Systems are listed down below: ► 7. Lively Mobile2 - <a href="" ► 6. UnaliWear Kanega Watch - <a href="" ► 5.",https://www.msn.com/en-us/news/technology/7-best-medical-altert-systems-for-seniors-with-fall-detection-2025/vi-AA1EKrC1,,Amazon S3
"BrainCheck",2018-12-24T06:00:00+00:00,Braincheck Raises Another $1.5 Million to Bring Artificial Intelligence to Dementia Care,"HOUSTON, Jan. 03, 2019 /PRNewswire-PRWeb/ -- BrainCheck, a Texas-based digital neurocognitive testing platform, has raised $1.5 million in additional capital to bring AI and personalized medicine ...",https://markets.businessinsider.com/news/stocks/braincheck-raises-another-1-5-million-to-bring-artificial-intelligence-to-dementia-care-1027831188,,Business Insider
"BrainCheck",2021-11-03T11:05:00+00:00,"BrainCheck brings in another $10M to detect, manage cognitive impairment","BrainCheck, a Houston- and Austin-based company developing cognitive healthcare software to aid physicians in detecting and managing this type of care, raised $10 million in Series B funding to ...",https://techcrunch.com/2021/11/03/braincheck-brings-in-another-10m-to-detect-manage-cognitive-impairment/,,TechCrunch
"Dermala",2021-10-12T07:00:00+00:00,"DERMALA, A Consumer Dermatology Company, Announces Several Additions to a Successful Acne Product Range","SAN DIEGO, Oct. 12, 2021 /PRNewswire/ -- DERMALA, the only personalized, clinically proven treatment for acne powered by the human microbiome extends its product line-up with the addition of six ...",https://markets.businessinsider.com/news/stocks/dermala-a-consumer-dermatology-company-announces-several-additions-to-a-successful-acne-product-range-1030858579,,Business Insider
"Dermala",2022-06-07T12:00:00+00:00,"DERMALA, A CONSUMER DERMATOLOGY COMPANY, LAUNCHES AT-HOME, PERSONALIZED SKIN TESTS","June 7, 2022 /PRNewswire/ -- DERMALA, a consumer dermatology company leveraging a scientific understanding of the human microbiome to develop the next generation of products for chronic skin ...",https://ktla.com/business/press-releases/cision/20220607FL79869/dermala-a-consumer-dermatology-company-launches-at-home-personalized-skin-tests/,,KTLA
"Oralucent","2025-05-28","No news",,,,
"Flowly",2021-07-02T23:00:00+00:00,'Flowly' that scientifically reduces pain and anxiety with VR and smartphones,"Flowly ' is a VR system that can distract you from pain and anxiety by medical methods. Flowly was created with the ease of use at home and scientific backing in mind, and at the time of ...",https://gigazine.net/gsc_news/en/20210702-flowly,,GIGAZINE
"Flowly",2021-03-23T19:32:00+00:00,Sunny Leone makes a statement in strapless flowly gown in Kerala,The actress looked ethereal in a beige and gold gown. The beige chiffon gown with a golden sparkly corset with a tube sweetheart neckline. She kept her makeup dewy and fresh with her hair in a ...,https://www.bollywoodhungama.com/news/features/sunny-leone-makes-statement-strapless-flowly-gown-kerala/,,Bollywood Hungama
"Rosy Wellness",2024-06-20T15:00:00+00:00,"LevLane Advertising and Rosy Wellness Release Women's Health White Paper: ""The Women Are Not Alright""","PHILADELPHIA, June 20, 2024 (GLOBE NEWSWIRE) -- LevLane Advertising, one of Philadelphia's oldest independent, full-service advertising agencies, and Rosy Wellness, the Webby Award-winning app ...",https://kfor.com/business/press-releases/globenewswire/9156554/levlane-advertising-and-rosy-wellness-release-womens-health-white-paper-the-women-are-not-alright/,,Oklahoma's News
"De Oro Devices",2024-01-18T17:05:00+00:00,"De Oro Devices Names Cori Lathan, PhD, as New CEO","Dr. Lathan joins De Oro Devices from her previous role as CEO at AnthroTronix, where she successfully invented, developed, and commercialized medical technology for over 20 years before leading ...",https://finance.yahoo.com/news/oro-devices-names-cori-lathan-220500791.html,,Yahoo Finance
"De Oro Devices",2023-01-25T00:00:00+00:00,New device helps Clovis veteran with Parkinson's walk again,"CLOVIS, Calif. (KFSN) -- The simple act of walking can be challenging for those living with Parkinson's disease, which affects movement. However, a Clovis veteran is now on the move with the help ...",https://abc30.com/parkinsons-disease-nexstride-device-de-oro-devices-clovis-veteran-able-to-walk/12728394/,,ABC30 Action News
"Partum Health",2024-07-16T00:00:00+00:00,Automated appointment scheduling and reminder messages may improve post-partum health and well-being for those with chronic health conditions,A new study in JAMA Network Open found that an intervention involving automated appointment scheduling and reminder messages may improve post-partum health and well-being for these individuals.,https://www.eurekalert.org/news-releases/1051592,,EurekAlert!
"Fort Health",2024-11-12T17:07:00+00:00,Fort Health Secures $5.5M to Expand Access to Integrated Pediatric Mental Health Care,"Fort Health, an integrated behavioral health company, has secured $5.5 million, it announced Tuesday. It will use these funds to bring mental health services into more pediatricians' offices in ...",https://medcitynews.com/2024/11/pediatric-mental-health-funding/,,MedCity News
"Fort Health",2025-03-18T14:00:00+00:00,Fort Health Partners with Colleva to Train its Therapists with AI Patient Avatars for Role-Playing Practice and Scalable Client Care,"Using Fort Health's agentic AI training platform - which is modeled on the evidence-based treatment protocol, the Unified Protocol for children, adolescents, and caregivers - therapists ...",https://www.woodtv.com/business/press-releases/cision/20250318NY41483/fort-health-partners-with-colleva-to-train-its-therapists-with-ai-patient-avatars-for-role-playing-practice-and-scalable-client-care/,,WOOD-TV
"RubyWell","2025-05-28","No news",,,,
"Atlantic Sea Farms",2022-04-17T23:59:00+00:00,A Maine-based company is helping fishermen become kelp farmers to adapt to climate change,"""When you're putting it on your plate and replacing broccoli, you're actually adding something that is net positive,"" says Briana Warner, CEO of Atlantic Sea Farms. [Photo: courtesy ...",https://www.fastcompany.com/90741716/this-startup-in-maine-is-helping-fisherman-become-kelp-farmers-to-adapt-to-climate-change,,Fast Company
"Atlantic Sea Farms",2019-04-17T00:00:00+00:00,"With new retail products, Atlantic Sea Farms seeks to expand kelp market","Atlantic Sea Farms A kelp farm can produce three to seven pounds per foot of line. With up to 18,000 feet of line in the water, ""that's a lot of kelp,"" said Atlantic Sea Farms CEO Briana Warner.",https://www.mainebiz.biz/article/with-new-retail-products-atlantic-sea-farms-seeks-to-expand-kelp-market,,Mainebiz
"VidaFuel","2025-05-28","No news",,,,
"Aloqia",2025-04-03T02:18:00+00:00,Shein increases use of deadstock fabric by 40% in 2024,"Since 2022, Shein has sourced over 47,900 metres of deadstock fabric through Aloqia, leading to estimated savings of 357,600 cubic metres of water, 7,400 kilograms of chemicals, and 70 metric tons ...",https://www.msn.com/en-xl/news/other/shein-increases-use-of-deadstock-fabric-by-40-in-2024/ar-AA1CbCXN,,MSN
"Refiberd",2025-04-11T18:49:00+00:00,eBay invests $300k in Refiberd to boost circular fashion with AI,"eBay hopes the investment will enhance the reach of Refiberd's advanced AI system, which can identify the composition of textiles to ensure proper sorting and recycling. Refiberd uses its ...",https://www.msn.com/en-us/money/companies/ebay-invests-300k-in-refiberd-to-boost-circular-fashion-with-ai/ar-AA1CLdiz,,MSN
"Refiberd",2025-04-09T14:24:00+00:00,EBay's Circular Fashion Fund Crowns Refiberd Its First Circular Fashion Innovator of the Year,"EBay's Circular Fashion Fund has officially announced Refiberd as its Circular Fashion Innovator of the Year awarding the company with an investment of $300,000. The company's discerning AI ...",https://www.yahoo.com/lifestyle/ebay-circular-fashion-fund-crowns-142425945.html,,Yahoo
"Jiminy's","2025-05-28","No news",,,,
"Aeromutable","2025-05-28","No news",,,,
