company,date,title,body,url,image,source
"Unaliwear",2024-02-15T08:19:00+00:00,UnaliWear Medical Alert Watch Review In 2025,"Our editors also may be in touch with follow-up questions. The water-resistant UnaliWear Kanega Watch is a medical alert device that provides automatic fall detection, 24/7 monitoring and ...",https://www.forbes.com/health/medical-alert-systems/unaliwear-review/,,Forbes
"Unaliwear",2025-05-13T00:00:00+00:00,UnaliWear Kanega Watch Reviews,The UnaliWear Kanega Watch is a more discreet alternative to traditional medical alert devices. The watch weighs 49 grams (about 1.7 ounces). It's 1.6 inches in diameter and 0.5 inches thick.,https://www.consumeraffairs.com/medical-alert-systems/unaliwear-kanega-watch.html,,ConsumerAffairs
"BrainCheck",2023-10-24T09:00:00+00:00,BrainCheck Expands First End-to-End Solution for Cognitive Care,Company introduces next generation of its comprehensive platform and 3-minute screening tool at Clinical Trials on Alzheimer's Disease (CTAD) conference New research supporting BrainCheck platform ...,https://finance.yahoo.com/news/braincheck-expands-first-end-end-130000828.html,,Yahoo Finance
"BrainCheck",2022-11-14T09:05:00+00:00,BrainCheck Awarded $1.5M Grant by US Small Business Innovation Research (SBIR) Program to Measure Effectiveness of Digital Cognitive Care Management Platform,"LAS VEGAS--(BUSINESS WIRE)--BrainCheck Inc., developer of the innovative digital cognitive assessment and care management platform, today announced a $1.5M grant award from the Small Business ...",https://www.businesswire.com/news/home/20221114005009/en/BrainCheck-Awarded-1.5M-Grant-by-US-Small-Business-Innovation-Research-SBIR-Program-to-Measure-Effectiveness-of-Digital-Cognitive-Care-Management-Platform,,Business Wire
"Dermala",2021-10-12T07:00:00+00:00,"DERMALA, A Consumer Dermatology Company, Announces Several Additions to a Successful Acne Product Range","SAN DIEGO, Oct. 12, 2021 /PRNewswire/ -- DERMALA, the only personalized, clinically proven treatment for acne powered by the human microbiome extends its product line-up with the addition of six ...",https://markets.businessinsider.com/news/stocks/dermala-a-consumer-dermatology-company-announces-several-additions-to-a-successful-acne-product-range-1030858579,,Business Insider
"Dermala",2021-10-26T07:00:00+00:00,"DERMALA, A Consumer Dermatology Company, Announces Issuance of the Second U.S. Patent Covering the Use of Novel Human Microbiome Technology for Treating Acne Vulgaris","SAN DIEGO, Oct. 26, 2021 /PRNewswire/ -- DERMALA, a consumer dermatology company developing novel, personalized, microbiome-powered solutions for chronic skin conditions, announced today the ...",https://markets.businessinsider.com/news/stocks/dermala-a-consumer-dermatology-company-announces-issuance-of-the-second-u-s-patent-covering-the-use-of-novel-human-microbiome-technology-for-treating-acne-vulgaris-1030899083,,Business Insider
"Oralucent","2025-06-06","No news",,,,
"Flowly",2023-03-13T08:05:00+00:00,"Flowly, VR-enabled app to manage chronic pain and stress, rolls out program for providers","Flowly, an app for autonomic nervous system regulation, has launched a program for providers, the company has shared exclusively with Fierce Healthcare. Through the program, providers will receive ...",https://www.fiercehealthcare.com/digital-health/relaxation-app-vr-startup-flowly-rolls-out-program-providers,,Fierce Healthcare
"Flowly",2020-06-09T08:05:00+00:00,Flowly Offers Relief to 100 Million Americans Living with Chronic Pain and Anxiety,LOS ANGELES--(BUSINESS WIRE)--Flowly today officially launched its interactive mobile app to address chronic pain and anxiety. The platform offers immersive experiences in beautiful and peaceful ...,https://www.businesswire.com/news/home/20200609005289/en/Flowly-Offers-Relief-to-100-Million-Americans-Living-with-Chronic-Pain-and-Anxiety,,Business Wire
"Rosy Wellness",2025-06-04T12:00:00+00:00,Daré Bioscience and Rosy Wellness Announce Strategic Collaboration to Educate and Market Daré's DARE to PLAY Sildenafil Cream,"Collaboration will leverage Rosy Wellness' extensive reach and community of over 250,000 women Rosy Wellness is a multi-award winning app recommended by 8,000+ healthcare professionals Daré expects to start recording revenue in the 4th quarter this year SAN DIEGO,",https://finance.yahoo.com/news/dar-bioscience-rosy-wellness-announce-120000637.html,https://s.yimg.com/ny/api/res/1.2/IIZPSsivGxnOci.U38XKUA--/YXBwaWQ9aGlnaGxhbmRlcjt3PTEyMDA7aD05MDU-/https://media.zenfs.com/en/globenewswire.com/bb1d1625b47c6718857f64e784f0f2e4,Yahoo Finance
"Rosy Wellness",2025-06-04T08:07:00+00:00,Daré Bioscience partners with Rosy Wellness for new women's health cream,"Rosy Wellness, with its community of over 250,000 women and recommendation by more than 8,000 healthcare professionals, will leverage its digital reach and content-driven model to support the launch.",https://www.investing.com/news/company-news/dare-bioscience-partners-with-rosy-wellness-for-new-womens-health-cream-93CH-4080414,,Investing
"De Oro Devices",2024-01-18T17:05:00+00:00,"De Oro Devices Names Cori Lathan, PhD, as New CEO","Dr. Lathan joins De Oro Devices from her previous role as CEO at AnthroTronix, where she successfully invented, developed, and commercialized medical technology for over 20 years before leading ...",https://finance.yahoo.com/news/oro-devices-names-cori-lathan-220500791.html,,Yahoo Finance
"De Oro Devices",2023-01-25T00:00:00+00:00,New device helps Clovis veteran with Parkinson's walk again,"CLOVIS, Calif. (KFSN) -- The simple act of walking can be challenging for those living with Parkinson's disease, which affects movement. However, a Clovis veteran is now on the move with the help ...",https://abc30.com/parkinsons-disease-nexstride-device-de-oro-devices-clovis-veteran-able-to-walk/12728394/,,ABC30 Action News
"Partum Health",2023-06-03T23:59:00+00:00,INVEST Pitch Perfect Spotlight: How Partum Health Is Working To Transform Maternal Healthcare,"Meghan Doyle, co-founder and CEO of Partum Health, was working at a consulting firm in the healthcare sector when she first became a mom. It was during this time that she realized how confusing ...",https://medcitynews.com/2023/06/maternal-healthcare-postpartum-birth-fertility/,,MedCity News
"Partum Health",2023-06-04T13:56:00+00:00,Partum Health,"Partum Health, a maternal health startup, recently won the consumer/employer track of the MedCity News INVEST Pitch Perfect contest. The direct-to-consumer company supports families during ...",https://medcitynews.com/tag/partum-health/,,MedCity News
"Fort Health",2024-11-18T00:00:00+00:00,"At Fort Health, My Teen Finally Found a Therapist He Doesn't Hate","Everyday Health independently vets all recommended products. If you purchase a featured product, we may be compensated. Learn why you can trust us. Everyday Health independently vets all ...",https://www.everydayhealth.com/emotional-health/fort-health-review/,,Everyday Health
"Fort Health",2023-02-08T09:00:00+00:00,Fort Health - a New Model to Tackle the Youth Mental Health Crisis in Partnership with Pediatricians,"NEW YORK--(BUSINESS WIRE)--Fort Health, Inc., built in partnership with the Child Mind Institute, the leading independent nonprofit in children's mental health, announces a new virtual mental ...",https://www.businesswire.com/news/home/20230208005244/en/Fort-Health-a-New-Model-to-Tackle-the-Youth-Mental-Health-Crisis-in-Partnership-with-Pediatricians,,Business Wire
"RubyWell","2025-06-06","No news",,,,
"Atlantic Sea Farms",2022-03-16T00:00:00+00:00,Can Small Seaweed Farms Help Kelp Scale Up?,"Atlantic Sea Farms, the first commercial edible seaweed farm in the U.S.—founded in 2006 under the name Ocean Approved—is poised to take advantage of the moment. When Briana Warner, 37, took over as CEO in mid-2018, the Maine-based company was ...",https://civileats.com/2022/03/16/can-small-seaweed-farms-help-kelp-scale-up/,,Civil Eats
"Atlantic Sea Farms",2022-07-25T00:00:00+00:00,Seaweed helps Maine lobstermen ride the storm of climate change,"""They're ready for harvest,"" she declares. As the CEO and president of Atlantic Sea Farms, the 38-year-old Warner is using seaweed to quietly revolutionize Maine's struggling fishing industr",https://www.washingtonpost.com/food/2022/07/25/seaweed-maine-lobster-industry/,,The Washington Post
"VidaFuel",2020-10-30T00:00:00+00:00,Vidafuel Nutrition Closes Oversubscribed $1.075 Million Financing to Advance its Clinical Nutrition Brand,"Vidafuel, a company developing next-generation clinical nutrition products for use at-home and in the healthcare setting, announced it has closed an oversubscribed $1.075 million financing.",https://www.digitaljournal.com/pr/4861343,,Digital Journal
"VidaFuel",2018-05-29T13:18:00+00:00,"Jumpstart Foundry announces 2018 portfolio, brings startups to Nashville","Jumpstart Foundry brought 13 health care startups to Music City for two days of health care industry networking. Jumpstart Foundry announced its 2018 investment portfolio Tuesday, but the process ...",https://www.bizjournals.com/nashville/news/2018/05/29/jumpstart-foundry-announces-2018-portfolio-brings.html,,The Business Journals
"Aloqia",2025-04-03T02:18:00+00:00,Shein increases use of deadstock fabric by 40% in 2024,"Since 2022, Shein has sourced over 47,900 metres of deadstock fabric through Aloqia, leading to estimated savings of 357,600 cubic metres of water, 7,400 kilograms of chemicals, and 70 metric tons ...",https://www.msn.com/en-xl/news/other/shein-increases-use-of-deadstock-fabric-by-40-in-2024/ar-AA1CbCXN,,MSN
"Refiberd",2025-04-11T18:49:00+00:00,eBay invests $300k in Refiberd to boost circular fashion with AI,"eBay hopes the investment will enhance the reach of Refiberd's advanced AI system, which can identify the composition of textiles to ensure proper sorting and recycling. Refiberd uses its ...",https://www.msn.com/en-us/money/companies/ebay-invests-300k-in-refiberd-to-boost-circular-fashion-with-ai/ar-AA1CLdiz,,MSN
"Refiberd",2023-08-29T14:59:00+00:00,Refiberd sews up $3.4M seed round to use its AI to tackle textile waste,"It represents almost 6% of all solid waste in the U.S. ""It's crazy when you think about volumes here,"" Sarika Bajaj, co-founder and CEO of Refiberd, told TechCrunch+. For many years ...",https://techcrunch.com/2023/08/29/refiberd-textile-waste-sorting/,,TechCrunch
"Jiminy's",2020-02-19T00:00:00+00:00,My Dog Loves These Cricket Protein Treats More Than She Loves Me,"That seems more like something you do for a pet snake than a toy poodle. But when a bag of Jiminy's cricket treats were sent to the office by a publicist, I decided to bring them home.",https://nymag.com/strategist/article/jiminys-cricket-treats-review.html,,New York Magazine
"Jiminy's",2022-09-13T00:00:00+00:00,Pets eat a lot of meat. Insects could lower their carbon pawprint.,"Here's How Anne Carlson, the founder and CEO of Jiminy's, discovered this when she began experimenting with bringing insect protein to the pet food industry. She started with cricket treats ...",https://grist.org/food/sustainable-cricket-dog-food-jiminys/,,Grist
"Aeromutable","2025-06-06","No news",,,,
